{
  "$schema": "http://json-schema.org/draft-07/schema#",
  "$id": "tracksmart/account/menu_access_overrides.json",
  "title": "menu_access_overrides",
  "description": "The default menu-access table lives in code (`roles.data.ts`). This collection holds only the cells an admin changed, keyed by menu. Account's key is `account`.",
  "type": "object",
  "additionalProperties": false,
  "properties": {
    "_id": {
      "type": "string",
      "description": "Menu key (\"account\", \"inventory\", …)."
    },
    "overrides": {
      "type": "object",
      "description": "`{ role: \"full\"|\"light\"|\"hidden\" }` for the roles that differ from the default.",
      "default": {}
    },
    "updatedByUserId": {
      "type": "string",
      "description": "→ `users._id`."
    },
    "createdAt": {
      "type": "string",
      "format": "date-time",
      "description": "Set by the server on insert."
    },
    "updatedAt": {
      "type": "string",
      "format": "date-time",
      "description": "Set by the server on every write."
    }
  },
  "required": [
    "_id",
    "overrides",
    "createdAt",
    "updatedAt"
  ]
}