[
  {
    "_id": "account",
    "overrides": {
      "safety-manager": "full"
    },
    "updatedByUserId": "usr-0002",
    "createdAt": "2026-09-12T10:00:00Z",
    "updatedAt": "2026-09-12T10:00:00Z"
  },
  {
    "_id": "inventory",
    "overrides": {
      "user": "light"
    },
    "updatedByUserId": "usr-0002",
    "createdAt": "2026-09-12T10:05:00Z",
    "updatedAt": "2026-09-12T10:05:00Z"
  }
]